<?xml version="1.0" encoding="UTF-8"?>
<services xmlns="http://www.example.org/service-enabled"
	xmlns:xsi="http://www.w3.org/2001/XMLSchema-instance"
	xsi:schemaLocation="http://www.example.org/service-enabled service-enabled.xsd ">
	<service enabled="true" name="Get_User_Person" />
	<service enabled="true" name="Import_Previous" />
	<service enabled="true" name="Import_Previous_Autocomplete" />
	<service enabled="true" name="Priority_Import" />
	<service enabled="true" name="Priority_Manual" />
	<service enabled="false" name="Priority_Autocomplete" />
	<service enabled="true" name="Transformation_Import" />
	<service enabled="true" name="Transformation_Manual" />
	<service enabled="true" name="Transformation_Autocomplete" />
	<service enabled="true" name="Inventor_Import" />
	<service enabled="true" name="Inventor_Search" />
	<service enabled="true" name="Inventor_Autocomplete" />
	<service enabled="true" name="Inventor_Match" />
	<service enabled="true" name="Applicant_Import" />
	<service enabled="true" name="Applicant_Autocomplete" />
	<service enabled="true" name="Applicant_Match" />
	<service enabled="false" name="Applicant_Save" />
	<service enabled="true" name="Representative_Import" />
	<service enabled="true" name="Representative_Autocomplete" />
	<service enabled="true" name="Representative_Match" />
	<service enabled="false" name="Representative_Save" />
	<service enabled="true" name="Representative_Manual" />
	<service enabled="true" name="Person_Search" />
	<service enabled="true" name="Claim_Search" />
	<service enabled="false" name="Representative_Association_Autocomplete" />
	<service enabled="true" name="Save_Load_Service" />
	<service enabled="true" name="FeedBack" />
	<service enabled="true" name="Communication_Inbox" />
	<service enabled="false" name="Misleading_Information" />
	<service enabled="true" name="HelpMessage_Service"/>
	<service enabled="true" name="HelpMessage_Service_UsesFiles"/>
	<service enabled="false" name="Payment_Popup"/>
	<service enabled="false" name="Payment_Now"/>
	<service enabled="true" name="Payment_Later"/>
	<service enabled="false" name="Submit"/>
	<service enabled="true" name="Import_Divisional" />
	<service enabled="true" name="Import_Divisional_Autocomplete" />
	<service enabled="true" name="Divisional_Manual" />
	<service enabled="true" name="ParallelApplication_Import" />
	<service enabled="true" name="ParallelApplication_Autocomplete" />
	<service enabled="true" name="ParallelApplication_Manual" />
	<service enabled="true" name="Import_Patent_Template" />
	<service enabled="true" name="Import_Patent_Template_Autocomplete" />
	<service enabled="true" name="Submit_Portal"/>
	<service enabled="true" name="Patent_Autocomplete"/>
</services>
